{
  "id": "sense:phb:darkvision",
  "name": "Darkvision",
  "sourceMetadata": {
    "source": "PHB",
    "page": 183
  },
  "capabilities": [
    {
      "kind": "SIGHT",
      "perceives": [
        "visible-creatures",
        "objects",
        "visual-detail"
      ],
      "conditions": [
        "darkness"
      ],
      "darknessAs": "dim-light",
      "colorPerception": "grayscale",
      "dimLightAs": "bright-light"
    }
  ]
}
